{
  "run_id": "run-normal-001",
  "specimen_id": "coupon-normal-001",
  "material_state_id": "state-normal-001",
  "emitter_state_id": "emitter-isotropic-001",
  "energization": "11",
  "analysis_role": "held_out",
  "material_stage": "normal",
  "amplitude_level": 1.0,
  "mediator_id": "mediator-a",
  "normal_analysis_locked": false,
  "destructive": false,
  "precursor_analysis_locked": false
}
